"keys","en","jp","pr"
"REDOT_PONG","Redot Pong","リードットポン。",""
"BY_LINE","a game by swashberry","スワッシュベリーが書いたゲーム",""
"START_GAME","Start Game","","Set Sail"
"LEGAL_STUFF","Legal Stuff","","Plunder"
"LICENSE_SCREEN_INFO","Clicking one of the buttons below will display licensing information for individual components of Redot Pong and the engine it is built on, the Redot Engine. The full text of each license can be found by scrolling to the bottom.","","Arrrrr!  Despite how it may appearrr, this here booty was all acquired legally!  If ye be a law-abidin' landlubber, ye can check fer yerself by clickin' the buttons below decks!"
